{
  "id": "K-sec-0008",
  "type": "fact",
  "namespace": "security",
  "claim": "To store a value a GitHub Action needs, a repository admin opens the repository Settings, then Secrets and variables under the Security section, then Actions, the Secrets tab, and New repository secret, and enters a name and the value. A workflow refers to it by name through the secrets context, never by value. A secret cannot be used directly in an if condition; assign it to a job-level environment variable first. GitHub advises masking non-secret sensitive values and avoiding passing secrets on the command line. Secrets over 48 KB are not supported directly.",
  "source": {
    "ref": "https://docs.github.com/en/actions/security-for-github-actions/security-guides/using-secrets-in-github-actions",
    "locator": "creating secrets for a repository; using secrets in a workflow; limits",
    "retrieved_at": "2026-10-07T15:05:00-04:00"
  },
  "trust_grade": "A",
  "confidence": "high",
  "stated_by": "source",
  "written_at": "2026-10-07T15:05:00-04:00",
  "last_confirmed_at": "2026-10-07T15:05:00-04:00",
  "expires_at": "2027-01-07T15:05:00-05:00",
  "status": "verified",
  "owner_agent": "03-guardian"
}
