{
  "id": "K-sec-0009",
  "type": "fact",
  "namespace": "security",
  "claim": "For gh0stl0nely/business-assets (public) a read-only GitHub API call on 2026-10-07 shows secret_scanning, secret_scanning_push_protection, secret_scanning_non_provider_patterns and secret_scanning_validity_checks all 'disabled'. GitHub's About secret scanning page says scanning 'runs automatically for free' on public repositories, but that partner secrets 'are reported directly to the provider and aren't displayed in your repository alerts'. So automatic scanning does not mean the owner is told about a leak; repository alerts and push protection are off until an admin enables them. Enabling (docs): Settings, then Security and quality, Advanced Security; to the right of Secret Protection click Enable and confirm; then, in the Secret Protection section, to the right of Push protection, click Enable. Push protection needs the repository owner or an admin role. This supersedes the 'runs on its own' reading of K-sec-0003 for this repository.",
  "source": {
    "ref": "https://docs.github.com/en/code-security/secret-scanning/enabling-secret-scanning-features/enabling-secret-scanning-for-your-repository",
    "locator": "steps 1 to 5; also about-secret-scanning (partner patterns) and enabling-push-protection-for-your-repository (steps 4 and 5, required role); live state from GET /repos/gh0stl0nely/business-assets, field security_and_analysis, read 2026-10-07",
    "retrieved_at": "2026-10-07T16:30:00-04:00"
  },
  "trust_grade": "A",
  "confidence": "high",
  "stated_by": "source",
  "written_at": "2026-10-07T16:30:00-04:00",
  "last_confirmed_at": "2026-10-07T16:30:00-04:00",
  "expires_at": "2026-12-07T16:30:00-05:00",
  "status": "verified",
  "owner_agent": "03-guardian",
  "supersedes": "K-sec-0003"
}
