{
  "id": "K-sec-0003",
  "type": "fact",
  "namespace": "security",
  "claim": "GitHub secret scanning runs automatically and at no cost on public repositories. On private repositories it needs GitHub Secret Protection on a Team or Enterprise Cloud account. This repository is public, so no paid plan is needed for it today; making it private would change that.",
  "source": {
    "ref": "https://docs.github.com/en/code-security/secret-scanning/introduction/about-secret-scanning",
    "locator": "availability by repository visibility; also https://docs.github.com/en/code-security/getting-started/github-security-features",
    "retrieved_at": "2026-10-07T14:41:00-04:00"
  },
  "trust_grade": "A",
  "confidence": "high",
  "stated_by": "source",
  "written_at": "2026-10-07T14:41:00-04:00",
  "last_confirmed_at": "2026-10-07T14:41:00-04:00",
  "expires_at": "2027-01-07T14:41:00-05:00",
  "status": "verified",
  "owner_agent": "03-guardian"
}
